{
  "command_id": "13131313-1313-4313-8313-131313131313",
  "schema_version": 1,
  "command_type": "workspace.revision_promote",
  "project_id": "22222222-2222-4222-8222-222222222222",
  "activity_id": "33333333-3333-4333-8333-333333333333",
  "session_id": "pi:session:m3-promote",
  "workbench_id": "canvas",
  "correlation_id": "44444444-4444-4444-8444-444444444444",
  "expected_revision_id": "66666666-6666-4666-8666-666666666666",
  "variant_id": "55555555-5555-4555-8555-555555555555",
  "base_revision_id": "66666666-6666-4666-8666-666666666666",
  "payload": {
    "variant_id": "55555555-5555-4555-8555-555555555555",
    "candidate_revision_id": "88888888-8888-4888-8888-888888888888"
  }
}
