{
  "command_id": "16161616-1616-4161-8161-161616161616",
  "schema_version": 1,
  "command_type": "workspace.merge_create",
  "project_id": "22222222-2222-4222-8222-222222222222",
  "activity_id": "33333333-3333-4333-8333-333333333333",
  "session_id": "pi:session:m3-merge",
  "workbench_id": "code",
  "correlation_id": "44444444-4444-4444-8444-444444444444",
  "expected_revision_id": "66666666-6666-4666-8666-666666666666",
  "variant_id": "55555555-5555-4555-8555-555555555555",
  "base_revision_id": "88888888-8888-4888-8888-888888888888",
  "payload": {
    "candidate_revision_id": "77777777-7777-4777-8777-777777777777",
    "message": "Create resolved merge candidate",
    "files": [
      {
        "path": "strategy.py",
        "artifact": {
          "artifact_id": "90909090-9090-4909-8909-909090909090",
          "sha256": "aaaaaaaaaaaaaaaaaaaaaaaaaaaaaaaaaaaaaaaaaaaaaaaaaaaaaaaaaaaaaaaa",
          "media_type": "text/plain",
          "byte_size": 14,
          "storage_uri": "cas://sha256/aaaaaaaaaaaaaaaaaaaaaaaaaaaaaaaaaaaaaaaaaaaaaaaaaaaaaaaaaaaaaaaa",
          "producing_revision_id": null,
          "producing_run_id": null,
          "provenance": {
            "origin_kind": "fixture",
            "source_ref": "15151515-1515-4515-8515-151515151515"
          }
        }
      }
    ]
  }
}
