{
  "command_id": "51515151-5151-4151-8151-515151515151",
  "schema_version": 1,
  "command_type": "forward_test.request",
  "project_id": "22222222-2222-4222-8222-222222222222",
  "activity_id": "33333333-3333-4333-8333-333333333333",
  "session_id": "pi:session:m5-run",
  "workbench_id": "forward-test",
  "correlation_id": "44444444-4444-4444-8444-444444444444",
  "expected_revision_id": "77777777-7777-4777-8777-777777777777",
  "variant_id": "55555555-5555-4555-8555-555555555555",
  "base_revision_id": "77777777-7777-4777-8777-777777777777",
  "payload": {
    "forward_test_id": "52525252-5252-4252-8252-525252525252",
    "source_run_id": "18181818-1818-4181-8181-181818181818",
    "protocol_version": "oqs-forward-replay/m5-v1"
  }
}
