{
  "command_id": "10101010-1010-4101-8101-101010101010",
  "schema_version": 1,
  "command_type": "workspace.revision_create",
  "project_id": "22222222-2222-4222-8222-222222222222",
  "activity_id": "33333333-3333-4333-8333-333333333333",
  "session_id": "pi:session:m3-root",
  "workbench_id": "code",
  "correlation_id": "44444444-4444-4444-8444-444444444444",
  "expected_revision_id": null,
  "variant_id": null,
  "base_revision_id": null,
  "payload": {
    "revision_id": "88888888-8888-4888-8888-888888888888",
    "message": "Create root revision",
    "files": [
      {
        "path": "strategy.py",
        "artifact": {
          "artifact_id": "90909090-9090-4909-8909-909090909090",
          "sha256": "aaaaaaaaaaaaaaaaaaaaaaaaaaaaaaaaaaaaaaaaaaaaaaaaaaaaaaaaaaaaaaaa",
          "media_type": "text/plain",
          "byte_size": 14,
          "storage_uri": "cas://sha256/aaaaaaaaaaaaaaaaaaaaaaaaaaaaaaaaaaaaaaaaaaaaaaaaaaaaaaaaaaaaaaaa",
          "producing_revision_id": null,
          "producing_run_id": null,
          "provenance": {
            "origin_kind": "fixture",
            "source_ref": "15151515-1515-4515-8515-151515151515"
          }
        }
      },
      {
        "path": "src/signals.py",
        "artifact": {
          "artifact_id": "91919191-9191-4919-8919-919191919191",
          "sha256": "bbbbbbbbbbbbbbbbbbbbbbbbbbbbbbbbbbbbbbbbbbbbbbbbbbbbbbbbbbbbbbbb",
          "media_type": "text/plain",
          "byte_size": 27,
          "storage_uri": "cas://sha256/bbbbbbbbbbbbbbbbbbbbbbbbbbbbbbbbbbbbbbbbbbbbbbbbbbbbbbbbbbbbbbbb",
          "producing_revision_id": null,
          "producing_run_id": null,
          "provenance": {
            "origin_kind": "fixture",
            "source_ref": "16161616-1616-4616-8616-161616161616"
          }
        }
      }
    ]
  }
}
