{
  "command_id": "42424242-4242-4242-8242-424242424242",
  "schema_version": 1,
  "command_type": "diagnostic.log_retention_configure",
  "project_id": "22222222-2222-4222-8222-222222222222",
  "activity_id": "33333333-3333-4333-8333-333333333333",
  "session_id": "pi:session:m5-run",
  "workbench_id": "settings",
  "correlation_id": "44444444-4444-4444-8444-444444444444",
  "expected_revision_id": null,
  "variant_id": null,
  "base_revision_id": null,
  "payload": {
    "debug_days": 7,
    "info_days": 30,
    "warn_days": 90,
    "quota_bytes": 2147483648
  }
}
